{
  "format": "gams.gbml",
  "version": 1,
  "source": {
    "language": "bulletml-0.21",
    "orientation": "none",
    "path": "examples/[Dodonpachi]_hibachi.xml"
  },
  "compatibility": {
    "semantics": "gams-corrected-v1"
  },
  "entrypoints": [
    {
      "name": "top",
      "action": "action:top"
    }
  ],
  "definitions": {
    "actions": [
      {
        "id": "action:allWay",
        "label": "allWay",
        "ops": [
          {
            "op": "fire",
            "fire": {
              "id": "inline_fire",
              "direction": {
                "mode": "aim",
                "expr": 0
              },
              "speed": {
                "mode": "absolute",
                "expr": 1
              },
              "bullet": {
                "kind": "bullet",
                "bullet": {
                  "id": "inline_bullet"
                }
              }
            }
          },
          {
            "op": "repeat",
            "times": 2,
            "action": {
              "id": "inline_action",
              "ops": [
                {
                  "op": "fire",
                  "fire": {
                    "id": "inline_fire",
                    "direction": {
                      "mode": "sequence",
                      "expr": 3
                    },
                    "speed": {
                      "mode": "sequence",
                      "expr": 4
                    },
                    "bullet": {
                      "kind": "bullet",
                      "bullet": {
                        "id": "inline_bullet"
                      }
                    }
                  }
                }
              ]
            }
          }
        ]
      },
      {
        "id": "action:right",
        "label": "right",
        "ops": [
          {
            "op": "changeDirection",
            "term": 6,
            "direction": {
              "mode": "absolute",
              "expr": 5
            }
          },
          {
            "op": "changeSpeed",
            "term": 8,
            "speed": {
              "mode": "absolute",
              "expr": 7
            }
          },
          {
            "op": "repeat",
            "times": 9,
            "action": {
              "id": "inline_action",
              "ops": [
                {
                  "op": "actionRef",
                  "actionRef": {
                    "label": "allWay"
                  }
                },
                {
                  "op": "wait",
                  "expr": 10
                }
              ]
            }
          }
        ]
      },
      {
        "id": "action:left",
        "label": "left",
        "ops": [
          {
            "op": "changeDirection",
            "term": 12,
            "direction": {
              "mode": "absolute",
              "expr": 11
            }
          },
          {
            "op": "changeSpeed",
            "term": 14,
            "speed": {
              "mode": "absolute",
              "expr": 13
            }
          },
          {
            "op": "repeat",
            "times": 15,
            "action": {
              "id": "inline_action",
              "ops": [
                {
                  "op": "actionRef",
                  "actionRef": {
                    "label": "allWay"
                  }
                },
                {
                  "op": "wait",
                  "expr": 16
                }
              ]
            }
          }
        ]
      },
      {
        "id": "action:top",
        "label": "top",
        "ops": [
          {
            "op": "repeat",
            "times": 17,
            "action": {
              "id": "inline_action",
              "ops": [
                {
                  "op": "actionRef",
                  "actionRef": {
                    "label": "right"
                  }
                },
                {
                  "op": "actionRef",
                  "actionRef": {
                    "label": "left"
                  }
                },
                {
                  "op": "actionRef",
                  "actionRef": {
                    "label": "left"
                  }
                },
                {
                  "op": "actionRef",
                  "actionRef": {
                    "label": "right"
                  }
                }
              ]
            }
          },
          {
            "op": "changeSpeed",
            "term": 19,
            "speed": {
              "mode": "absolute",
              "expr": 18
            }
          },
          {
            "op": "wait",
            "expr": 20
          }
        ]
      }
    ],
    "bullets": [],
    "fires": []
  },
  "expressions": [
    {
      "id": 0,
      "source": "-50+$rand*20"
    },
    {
      "id": 1,
      "source": "1+$rank"
    },
    {
      "id": 2,
      "source": "15+16*$rank*$rank"
    },
    {
      "id": 3,
      "source": "24-$rank*12"
    },
    {
      "id": 4,
      "source": "0"
    },
    {
      "id": 5,
      "source": "90"
    },
    {
      "id": 6,
      "source": "1"
    },
    {
      "id": 7,
      "source": "1"
    },
    {
      "id": 8,
      "source": "1"
    },
    {
      "id": 9,
      "source": "25"
    },
    {
      "id": 10,
      "source": "3"
    },
    {
      "id": 11,
      "source": "-90"
    },
    {
      "id": 12,
      "source": "1"
    },
    {
      "id": 13,
      "source": "1"
    },
    {
      "id": 14,
      "source": "1"
    },
    {
      "id": 15,
      "source": "25"
    },
    {
      "id": 16,
      "source": "3"
    },
    {
      "id": 17,
      "source": "2"
    },
    {
      "id": 18,
      "source": "0"
    },
    {
      "id": 19,
      "source": "1"
    },
    {
      "id": 20,
      "source": "1"
    }
  ]
}
