{
  "format": "gams.gbml",
  "version": 1,
  "source": {
    "language": "bulletml-0.21",
    "orientation": "none",
    "path": "examples/[Daiouzyou]_hibachi_1.xml"
  },
  "compatibility": {
    "semantics": "gams-corrected-v1"
  },
  "entrypoints": [
    {
      "name": "top",
      "action": "action:top"
    }
  ],
  "definitions": {
    "actions": [
      {
        "id": "action:top",
        "label": "top",
        "ops": [
          {
            "op": "repeat",
            "times": 0,
            "action": {
              "id": "inline_action",
              "ops": [
                {
                  "op": "fire",
                  "fire": {
                    "id": "inline_fire",
                    "direction": {
                      "mode": "aim",
                      "expr": 1
                    },
                    "speed": {
                      "mode": "absolute",
                      "expr": 2
                    },
                    "bullet": {
                      "kind": "bullet",
                      "bullet": {
                        "id": "inline_bullet"
                      }
                    }
                  }
                },
                {
                  "op": "fireRef",
                  "fireRef": {
                    "label": "n"
                  }
                },
                {
                  "op": "fireRef",
                  "fireRef": {
                    "label": "n"
                  }
                },
                {
                  "op": "fireRef",
                  "fireRef": {
                    "label": "n"
                  }
                },
                {
                  "op": "fireRef",
                  "fireRef": {
                    "label": "n"
                  }
                },
                {
                  "op": "fireRef",
                  "fireRef": {
                    "label": "n"
                  }
                },
                {
                  "op": "fireRef",
                  "fireRef": {
                    "label": "n"
                  }
                },
                {
                  "op": "fireRef",
                  "fireRef": {
                    "label": "n"
                  }
                },
                {
                  "op": "fireRef",
                  "fireRef": {
                    "label": "n"
                  }
                },
                {
                  "op": "fireRef",
                  "fireRef": {
                    "label": "n"
                  }
                },
                {
                  "op": "fireRef",
                  "fireRef": {
                    "label": "n"
                  }
                },
                {
                  "op": "fireRef",
                  "fireRef": {
                    "label": "n"
                  }
                },
                {
                  "op": "fireRef",
                  "fireRef": {
                    "label": "n"
                  }
                },
                {
                  "op": "fireRef",
                  "fireRef": {
                    "label": "n"
                  }
                },
                {
                  "op": "fireRef",
                  "fireRef": {
                    "label": "n"
                  }
                },
                {
                  "op": "fireRef",
                  "fireRef": {
                    "label": "n"
                  }
                },
                {
                  "op": "fireRef",
                  "fireRef": {
                    "label": "n"
                  }
                },
                {
                  "op": "wait",
                  "expr": 3
                }
              ]
            }
          }
        ]
      }
    ],
    "bullets": [],
    "fires": [
      {
        "id": "fire:n",
        "label": "n",
        "direction": {
          "mode": "sequence",
          "expr": 4
        },
        "speed": {
          "mode": "absolute",
          "expr": 5
        },
        "bullet": {
          "kind": "bullet",
          "bullet": {
            "id": "inline_bullet"
          }
        }
      }
    ]
  },
  "expressions": [
    {
      "id": 0,
      "source": "10+$rank*70"
    },
    {
      "id": 1,
      "source": "$rand*30-74+$rank*2"
    },
    {
      "id": 2,
      "source": "0.5+$rank*2"
    },
    {
      "id": 3,
      "source": "14-$rank*10"
    },
    {
      "id": 4,
      "source": "$rand*2+7-$rank*2"
    },
    {
      "id": 5,
      "source": "0.5+$rank*2"
    }
  ]
}
