{
  "format": "gams.gbml",
  "version": 1,
  "source": {
    "language": "bulletml-0.21",
    "orientation": "vertical",
    "path": "examples/[XEVIOUS]_garu_zakato.xml"
  },
  "compatibility": {
    "semantics": "gams-corrected-v1"
  },
  "entrypoints": [
    {
      "name": "top",
      "action": "action:top"
    }
  ],
  "definitions": {
    "actions": [
      {
        "id": "action:top",
        "label": "top",
        "ops": [
          {
            "op": "repeat",
            "times": 0,
            "action": {
              "id": "inline_action",
              "ops": [
                {
                  "op": "fire",
                  "fire": {
                    "id": "inline_fire",
                    "direction": {
                      "mode": "absolute",
                      "expr": 1
                    },
                    "speed": {
                      "mode": "absolute",
                      "expr": 2
                    },
                    "bullet": {
                      "kind": "bulletRef",
                      "ref": {
                        "label": "gzc"
                      }
                    }
                  }
                },
                {
                  "op": "wait",
                  "expr": 3
                }
              ]
            }
          },
          {
            "op": "wait",
            "expr": 4
          }
        ]
      }
    ],
    "bullets": [
      {
        "id": "bullet:gzc",
        "label": "gzc",
        "actions": [
          {
            "kind": "action",
            "action": {
              "id": "inline_action",
              "ops": [
                {
                  "op": "wait",
                  "expr": 5
                },
                {
                  "op": "repeat",
                  "times": 6,
                  "action": {
                    "id": "inline_action",
                    "ops": [
                      {
                        "op": "fire",
                        "fire": {
                          "id": "inline_fire",
                          "direction": {
                            "mode": "sequence",
                            "expr": 7
                          },
                          "bullet": {
                            "kind": "bulletRef",
                            "ref": {
                              "label": "spr"
                            }
                          }
                        }
                      }
                    ]
                  }
                },
                {
                  "op": "repeat",
                  "times": 8,
                  "action": {
                    "id": "inline_action",
                    "ops": [
                      {
                        "op": "fire",
                        "fire": {
                          "id": "inline_fire",
                          "direction": {
                            "mode": "sequence",
                            "expr": 9
                          },
                          "bullet": {
                            "kind": "bulletRef",
                            "ref": {
                              "label": "hrmSpr"
                            }
                          }
                        }
                      }
                    ]
                  }
                },
                {
                  "op": "vanish"
                }
              ]
            }
          }
        ]
      },
      {
        "id": "bullet:spr",
        "label": "spr",
        "speed": {
          "mode": "absolute",
          "expr": 10
        }
      },
      {
        "id": "bullet:hrmSpr",
        "label": "hrmSpr",
        "speed": {
          "mode": "absolute",
          "expr": 11
        },
        "actions": [
          {
            "kind": "action",
            "action": {
              "id": "inline_action",
              "ops": [
                {
                  "op": "changeSpeed",
                  "term": 13,
                  "speed": {
                    "mode": "absolute",
                    "expr": 12
                  }
                }
              ]
            }
          },
          {
            "kind": "action",
            "action": {
              "id": "inline_action",
              "ops": [
                {
                  "op": "repeat",
                  "times": 14,
                  "action": {
                    "id": "inline_action",
                    "ops": [
                      {
                        "op": "changeDirection",
                        "term": 16,
                        "direction": {
                          "mode": "aim",
                          "expr": 15
                        }
                      },
                      {
                        "op": "wait",
                        "expr": 17
                      }
                    ]
                  }
                }
              ]
            }
          }
        ]
      }
    ],
    "fires": []
  },
  "expressions": [
    {
      "id": 0,
      "source": "10"
    },
    {
      "id": 1,
      "source": "180"
    },
    {
      "id": 2,
      "source": "3"
    },
    {
      "id": 3,
      "source": "20-$rank*10+$rand*10"
    },
    {
      "id": 4,
      "source": "60"
    },
    {
      "id": 5,
      "source": "10+$rand*10"
    },
    {
      "id": 6,
      "source": "16"
    },
    {
      "id": 7,
      "source": "360/16"
    },
    {
      "id": 8,
      "source": "4"
    },
    {
      "id": 9,
      "source": "90"
    },
    {
      "id": 10,
      "source": "2"
    },
    {
      "id": 11,
      "source": "0"
    },
    {
      "id": 12,
      "source": "2"
    },
    {
      "id": 13,
      "source": "60"
    },
    {
      "id": 14,
      "source": "9999"
    },
    {
      "id": 15,
      "source": "0"
    },
    {
      "id": 16,
      "source": "40"
    },
    {
      "id": 17,
      "source": "1"
    }
  ]
}
