{
  "format": "gams.gbml",
  "version": 1,
  "source": {
    "language": "bulletml-0.21",
    "orientation": "vertical",
    "path": "examples/[MDA]_10flower_2.xml"
  },
  "compatibility": {
    "semantics": "gams-corrected-v1"
  },
  "entrypoints": [
    {
      "name": "top",
      "action": "action:top"
    }
  ],
  "definitions": {
    "actions": [
      {
        "id": "action:top",
        "label": "top",
        "ops": [
          {
            "op": "fire",
            "fire": {
              "id": "inline_fire",
              "direction": {
                "mode": "absolute",
                "expr": 0
              },
              "speed": {
                "mode": "absolute",
                "expr": 1
              },
              "bullet": {
                "kind": "bulletRef",
                "ref": {
                  "label": "seed",
                  "params": [
                    2,
                    3
                  ]
                }
              }
            }
          },
          {
            "op": "fire",
            "fire": {
              "id": "inline_fire",
              "direction": {
                "mode": "absolute",
                "expr": 4
              },
              "speed": {
                "mode": "absolute",
                "expr": 5
              },
              "bullet": {
                "kind": "bulletRef",
                "ref": {
                  "label": "seed",
                  "params": [
                    6,
                    7
                  ]
                }
              }
            }
          },
          {
            "op": "wait",
            "expr": 8
          }
        ]
      }
    ],
    "bullets": [
      {
        "id": "bullet:seed",
        "label": "seed",
        "actions": [
          {
            "kind": "action",
            "action": {
              "id": "inline_action",
              "ops": [
                {
                  "op": "changeSpeed",
                  "term": 10,
                  "speed": {
                    "mode": "absolute",
                    "expr": 9
                  }
                },
                {
                  "op": "wait",
                  "expr": 11
                },
                {
                  "op": "fire",
                  "fire": {
                    "id": "inline_fire",
                    "direction": {
                      "mode": "absolute",
                      "expr": 12
                    },
                    "speed": {
                      "mode": "absolute",
                      "expr": 13
                    },
                    "bullet": {
                      "kind": "bulletRef",
                      "ref": {
                        "label": "dummy"
                      }
                    }
                  }
                },
                {
                  "op": "repeat",
                  "times": 14,
                  "action": {
                    "id": "inline_action",
                    "ops": [
                      {
                        "op": "repeat",
                        "times": 15,
                        "action": {
                          "id": "inline_action",
                          "ops": [
                            {
                              "op": "fire",
                              "fire": {
                                "id": "inline_fire",
                                "direction": {
                                  "mode": "sequence",
                                  "expr": 16
                                },
                                "speed": {
                                  "mode": "absolute",
                                  "expr": 17
                                },
                                "bullet": {
                                  "kind": "bullet",
                                  "bullet": {
                                    "id": "inline_bullet"
                                  }
                                }
                              }
                            }
                          ]
                        }
                      },
                      {
                        "op": "wait",
                        "expr": 18
                      }
                    ]
                  }
                },
                {
                  "op": "vanish"
                }
              ]
            }
          }
        ]
      },
      {
        "id": "bullet:dummy",
        "label": "dummy",
        "actions": [
          {
            "kind": "action",
            "action": {
              "id": "inline_action",
              "ops": [
                {
                  "op": "vanish"
                }
              ]
            }
          }
        ]
      }
    ],
    "fires": []
  },
  "expressions": [
    {
      "id": 0,
      "source": "180"
    },
    {
      "id": 1,
      "source": "5"
    },
    {
      "id": 2,
      "source": "36.1"
    },
    {
      "id": 3,
      "source": "144"
    },
    {
      "id": 4,
      "source": "180"
    },
    {
      "id": 5,
      "source": "5"
    },
    {
      "id": 6,
      "source": "-36.4"
    },
    {
      "id": 7,
      "source": "3.4+144"
    },
    {
      "id": 8,
      "source": "164+316*$rank"
    },
    {
      "id": 9,
      "source": "0"
    },
    {
      "id": 10,
      "source": "4"
    },
    {
      "id": 11,
      "source": "4"
    },
    {
      "id": 12,
      "source": "$2"
    },
    {
      "id": 13,
      "source": "1.1"
    },
    {
      "id": 14,
      "source": "21+79*$rank"
    },
    {
      "id": 15,
      "source": "10"
    },
    {
      "id": 16,
      "source": "$1"
    },
    {
      "id": 17,
      "source": "1.1"
    },
    {
      "id": 18,
      "source": "4"
    }
  ]
}
