{
  "format": "gams.gbml",
  "version": 1,
  "source": {
    "language": "bulletml-0.21",
    "orientation": "vertical",
    "path": "examples/[Daiouzyou]_round_3_boss.xml"
  },
  "compatibility": {
    "semantics": "gams-corrected-v1"
  },
  "entrypoints": [
    {
      "name": "top",
      "action": "action:top"
    }
  ],
  "definitions": {
    "actions": [
      {
        "id": "action:top",
        "label": "top",
        "ops": [
          {
            "op": "fire",
            "fire": {
              "id": "inline_fire",
              "direction": {
                "mode": "absolute",
                "expr": 0
              },
              "speed": {
                "mode": "absolute",
                "expr": 1
              },
              "bullet": {
                "kind": "bulletRef",
                "ref": {
                  "label": "roll",
                  "params": [
                    2
                  ]
                }
              }
            }
          },
          {
            "op": "fire",
            "fire": {
              "id": "inline_fire",
              "direction": {
                "mode": "absolute",
                "expr": 3
              },
              "speed": {
                "mode": "absolute",
                "expr": 4
              },
              "bullet": {
                "kind": "bulletRef",
                "ref": {
                  "label": "roll",
                  "params": [
                    5
                  ]
                }
              }
            }
          },
          {
            "op": "fire",
            "fire": {
              "id": "inline_fire",
              "direction": {
                "mode": "absolute",
                "expr": 6
              },
              "speed": {
                "mode": "absolute",
                "expr": 7
              },
              "bullet": {
                "kind": "bulletRef",
                "ref": {
                  "label": "roll",
                  "params": [
                    8
                  ]
                }
              }
            }
          },
          {
            "op": "fire",
            "fire": {
              "id": "inline_fire",
              "direction": {
                "mode": "absolute",
                "expr": 9
              },
              "speed": {
                "mode": "absolute",
                "expr": 10
              },
              "bullet": {
                "kind": "bulletRef",
                "ref": {
                  "label": "roll",
                  "params": [
                    11
                  ]
                }
              }
            }
          },
          {
            "op": "fire",
            "fire": {
              "id": "inline_fire",
              "direction": {
                "mode": "absolute",
                "expr": 12
              },
              "speed": {
                "mode": "absolute",
                "expr": 13
              },
              "bullet": {
                "kind": "bulletRef",
                "ref": {
                  "label": "roll",
                  "params": [
                    14
                  ]
                }
              }
            }
          },
          {
            "op": "fire",
            "fire": {
              "id": "inline_fire",
              "direction": {
                "mode": "absolute",
                "expr": 15
              },
              "speed": {
                "mode": "absolute",
                "expr": 16
              },
              "bullet": {
                "kind": "bulletRef",
                "ref": {
                  "label": "roll",
                  "params": [
                    17
                  ]
                }
              }
            }
          },
          {
            "op": "wait",
            "expr": 18
          }
        ]
      }
    ],
    "bullets": [
      {
        "id": "bullet:roll",
        "label": "roll",
        "actions": [
          {
            "kind": "action",
            "action": {
              "id": "inline_action",
              "ops": [
                {
                  "op": "wait",
                  "expr": 19
                },
                {
                  "op": "changeSpeed",
                  "term": 21,
                  "speed": {
                    "mode": "absolute",
                    "expr": 20
                  }
                },
                {
                  "op": "fire",
                  "fire": {
                    "id": "inline_fire",
                    "direction": {
                      "mode": "absolute",
                      "expr": 22
                    },
                    "bullet": {
                      "kind": "bullet",
                      "bullet": {
                        "id": "inline_bullet",
                        "actions": [
                          {
                            "kind": "action",
                            "action": {
                              "id": "inline_action",
                              "ops": [
                                {
                                  "op": "vanish"
                                }
                              ]
                            }
                          }
                        ]
                      }
                    }
                  }
                },
                {
                  "op": "repeat",
                  "times": 23,
                  "action": {
                    "id": "inline_action",
                    "ops": [
                      {
                        "op": "fire",
                        "fire": {
                          "id": "inline_fire",
                          "direction": {
                            "mode": "sequence",
                            "expr": 24
                          },
                          "speed": {
                            "mode": "absolute",
                            "expr": 25
                          },
                          "bullet": {
                            "kind": "bullet",
                            "bullet": {
                              "id": "inline_bullet"
                            }
                          }
                        }
                      },
                      {
                        "op": "wait",
                        "expr": 26
                      }
                    ]
                  }
                },
                {
                  "op": "vanish"
                }
              ]
            }
          }
        ]
      }
    ],
    "fires": []
  },
  "expressions": [
    {
      "id": 0,
      "source": "155"
    },
    {
      "id": 1,
      "source": "3.3"
    },
    {
      "id": 2,
      "source": "1"
    },
    {
      "id": 3,
      "source": "205"
    },
    {
      "id": 4,
      "source": "3.3"
    },
    {
      "id": 5,
      "source": "-1"
    },
    {
      "id": 6,
      "source": "135"
    },
    {
      "id": 7,
      "source": "3.2"
    },
    {
      "id": 8,
      "source": "1"
    },
    {
      "id": 9,
      "source": "225"
    },
    {
      "id": 10,
      "source": "3.2"
    },
    {
      "id": 11,
      "source": "-1"
    },
    {
      "id": 12,
      "source": "135"
    },
    {
      "id": 13,
      "source": "2"
    },
    {
      "id": 14,
      "source": "1"
    },
    {
      "id": 15,
      "source": "225"
    },
    {
      "id": 16,
      "source": "2"
    },
    {
      "id": 17,
      "source": "-1"
    },
    {
      "id": 18,
      "source": "400"
    },
    {
      "id": 19,
      "source": "12"
    },
    {
      "id": 20,
      "source": "0"
    },
    {
      "id": 21,
      "source": "1"
    },
    {
      "id": 22,
      "source": "180+90*$1"
    },
    {
      "id": 23,
      "source": "200"
    },
    {
      "id": 24,
      "source": "9"
    },
    {
      "id": 25,
      "source": "1+$rank"
    },
    {
      "id": 26,
      "source": "2"
    }
  ]
}
