{
  "format": "gams.gbml",
  "version": 1,
  "source": {
    "language": "bulletml-0.21",
    "orientation": "vertical",
    "path": "examples/[Ketui_LT]_1boss_bit.xml"
  },
  "compatibility": {
    "semantics": "gams-corrected-v1"
  },
  "entrypoints": [
    {
      "name": "top",
      "action": "action:top"
    }
  ],
  "definitions": {
    "actions": [
      {
        "id": "action:XWay",
        "label": "XWay",
        "ops": [
          {
            "op": "actionRef",
            "actionRef": {
              "label": "XWayFan",
              "params": [
                0,
                1,
                2
              ]
            }
          }
        ]
      },
      {
        "id": "action:XWayFan",
        "label": "XWayFan",
        "ops": [
          {
            "op": "repeat",
            "times": 3,
            "action": {
              "id": "inline_action",
              "ops": [
                {
                  "op": "fire",
                  "fire": {
                    "id": "inline_fire",
                    "direction": {
                      "mode": "sequence",
                      "expr": 4
                    },
                    "speed": {
                      "mode": "sequence",
                      "expr": 5
                    },
                    "bullet": {
                      "kind": "bullet",
                      "bullet": {
                        "id": "inline_bullet"
                      }
                    }
                  }
                }
              ]
            }
          }
        ]
      },
      {
        "id": "action:3way",
        "label": "3way",
        "ops": [
          {
            "op": "repeat",
            "times": 6,
            "action": {
              "id": "inline_action",
              "ops": [
                {
                  "op": "wait",
                  "expr": 7
                },
                {
                  "op": "fire",
                  "fire": {
                    "id": "inline_fire",
                    "direction": {
                      "mode": "aim",
                      "expr": 8
                    },
                    "speed": {
                      "mode": "absolute",
                      "expr": 9
                    },
                    "bullet": {
                      "kind": "bullet",
                      "bullet": {
                        "id": "inline_bullet"
                      }
                    }
                  }
                },
                {
                  "op": "actionRef",
                  "actionRef": {
                    "label": "XWay",
                    "params": [
                      10,
                      11
                    ]
                  }
                }
              ]
            }
          }
        ]
      },
      {
        "id": "action:top",
        "label": "top",
        "ops": [
          {
            "op": "repeat",
            "times": 25,
            "action": {
              "id": "inline_action",
              "ops": [
                {
                  "op": "fire",
                  "fire": {
                    "id": "inline_fire",
                    "direction": {
                      "mode": "absolute",
                      "expr": 26
                    },
                    "speed": {
                      "mode": "absolute",
                      "expr": 27
                    },
                    "bullet": {
                      "kind": "bulletRef",
                      "ref": {
                        "label": "bit"
                      }
                    }
                  }
                },
                {
                  "op": "wait",
                  "expr": 28
                }
              ]
            }
          },
          {
            "op": "wait",
            "expr": 29
          }
        ]
      }
    ],
    "bullets": [
      {
        "id": "bullet:Dummy",
        "label": "Dummy",
        "actions": [
          {
            "kind": "action",
            "action": {
              "id": "inline_action",
              "ops": [
                {
                  "op": "vanish"
                }
              ]
            }
          }
        ]
      },
      {
        "id": "bullet:bit",
        "label": "bit",
        "actions": [
          {
            "kind": "action",
            "action": {
              "id": "inline_action",
              "ops": [
                {
                  "op": "repeat",
                  "times": 12,
                  "action": {
                    "id": "inline_action",
                    "ops": [
                      {
                        "op": "accel",
                        "term": 15,
                        "horizontal": {
                          "mode": "absolute",
                          "expr": 13
                        },
                        "vertical": {
                          "mode": "absolute",
                          "expr": 14
                        }
                      },
                      {
                        "op": "actionRef",
                        "actionRef": {
                          "label": "3way"
                        }
                      },
                      {
                        "op": "accel",
                        "term": 18,
                        "horizontal": {
                          "mode": "absolute",
                          "expr": 16
                        },
                        "vertical": {
                          "mode": "absolute",
                          "expr": 17
                        }
                      },
                      {
                        "op": "actionRef",
                        "actionRef": {
                          "label": "3way"
                        }
                      },
                      {
                        "op": "accel",
                        "term": 21,
                        "horizontal": {
                          "mode": "absolute",
                          "expr": 19
                        },
                        "vertical": {
                          "mode": "absolute",
                          "expr": 20
                        }
                      },
                      {
                        "op": "actionRef",
                        "actionRef": {
                          "label": "3way"
                        }
                      },
                      {
                        "op": "accel",
                        "term": 24,
                        "horizontal": {
                          "mode": "absolute",
                          "expr": 22
                        },
                        "vertical": {
                          "mode": "absolute",
                          "expr": 23
                        }
                      },
                      {
                        "op": "actionRef",
                        "actionRef": {
                          "label": "3way"
                        }
                      }
                    ]
                  }
                }
              ]
            }
          }
        ]
      }
    ],
    "fires": []
  },
  "expressions": [
    {
      "id": 0,
      "source": "$1"
    },
    {
      "id": 1,
      "source": "$2"
    },
    {
      "id": 2,
      "source": "0"
    },
    {
      "id": 3,
      "source": "$1-1"
    },
    {
      "id": 4,
      "source": "$2"
    },
    {
      "id": 5,
      "source": "$3"
    },
    {
      "id": 6,
      "source": "2"
    },
    {
      "id": 7,
      "source": "30"
    },
    {
      "id": 8,
      "source": "-3"
    },
    {
      "id": 9,
      "source": "1.4"
    },
    {
      "id": 10,
      "source": "3"
    },
    {
      "id": 11,
      "source": "2"
    },
    {
      "id": 12,
      "source": "3"
    },
    {
      "id": 13,
      "source": "0"
    },
    {
      "id": 14,
      "source": "1"
    },
    {
      "id": 15,
      "source": "60"
    },
    {
      "id": 16,
      "source": "-2"
    },
    {
      "id": 17,
      "source": "0"
    },
    {
      "id": 18,
      "source": "60"
    },
    {
      "id": 19,
      "source": "0"
    },
    {
      "id": 20,
      "source": "-1"
    },
    {
      "id": 21,
      "source": "60"
    },
    {
      "id": 22,
      "source": "2"
    },
    {
      "id": 23,
      "source": "0"
    },
    {
      "id": 24,
      "source": "60"
    },
    {
      "id": 25,
      "source": "4+$rank*6"
    },
    {
      "id": 26,
      "source": "90"
    },
    {
      "id": 27,
      "source": "2"
    },
    {
      "id": 28,
      "source": "245/(4+$rank*6)"
    },
    {
      "id": 29,
      "source": "550"
    }
  ]
}
