{
  "format": "gams.gbml",
  "version": 1,
  "source": {
    "language": "bulletml-0.21",
    "orientation": "none",
    "path": "examples/[ESP_RADE]_round_5_boss_gara_2.xml"
  },
  "compatibility": {
    "semantics": "gams-corrected-v1"
  },
  "entrypoints": [
    {
      "name": "top",
      "action": "action:top"
    }
  ],
  "definitions": {
    "actions": [
      {
        "id": "action:top",
        "label": "top",
        "ops": [
          {
            "op": "fire",
            "fire": {
              "id": "inline_fire",
              "direction": {
                "mode": "absolute",
                "expr": 15
              },
              "bullet": {
                "kind": "bulletRef",
                "ref": {
                  "label": "featherShot"
                }
              }
            }
          },
          {
            "op": "fire",
            "fire": {
              "id": "inline_fire",
              "direction": {
                "mode": "absolute",
                "expr": 16
              },
              "bullet": {
                "kind": "bulletRef",
                "ref": {
                  "label": "featherShot"
                }
              }
            }
          },
          {
            "op": "wait",
            "expr": 17
          }
        ]
      }
    ],
    "bullets": [
      {
        "id": "bullet:featherShot",
        "label": "featherShot",
        "speed": {
          "mode": "absolute",
          "expr": 0
        },
        "actions": [
          {
            "kind": "action",
            "action": {
              "id": "inline_action",
              "ops": [
                {
                  "op": "changeSpeed",
                  "term": 2,
                  "speed": {
                    "mode": "absolute",
                    "expr": 1
                  }
                },
                {
                  "op": "wait",
                  "expr": 3
                },
                {
                  "op": "fire",
                  "fire": {
                    "id": "inline_fire",
                    "bullet": {
                      "kind": "bulletRef",
                      "ref": {
                        "label": "featherAim"
                      }
                    }
                  }
                },
                {
                  "op": "repeat",
                  "times": 4,
                  "action": {
                    "id": "inline_action",
                    "ops": [
                      {
                        "op": "fire",
                        "fire": {
                          "id": "inline_fire",
                          "direction": {
                            "mode": "aim",
                            "expr": 5
                          },
                          "bullet": {
                            "kind": "bullet",
                            "bullet": {
                              "id": "inline_bullet"
                            }
                          }
                        }
                      },
                      {
                        "op": "wait",
                        "expr": 6
                      }
                    ]
                  }
                },
                {
                  "op": "vanish"
                }
              ]
            }
          }
        ]
      },
      {
        "id": "bullet:featherAim",
        "label": "featherAim",
        "speed": {
          "mode": "absolute",
          "expr": 7
        },
        "actions": [
          {
            "kind": "action",
            "action": {
              "id": "inline_action",
              "ops": [
                {
                  "op": "repeat",
                  "times": 8,
                  "action": {
                    "id": "inline_action",
                    "ops": [
                      {
                        "op": "fire",
                        "fire": {
                          "id": "inline_fire",
                          "speed": {
                            "mode": "absolute",
                            "expr": 9
                          },
                          "bullet": {
                            "kind": "bullet",
                            "bullet": {
                              "id": "inline_bullet"
                            }
                          }
                        }
                      },
                      {
                        "op": "repeat",
                        "times": 10,
                        "action": {
                          "id": "inline_action",
                          "ops": [
                            {
                              "op": "wait",
                              "expr": 11
                            },
                            {
                              "op": "fire",
                              "fire": {
                                "id": "inline_fire",
                                "direction": {
                                  "mode": "sequence",
                                  "expr": 12
                                },
                                "speed": {
                                  "mode": "absolute",
                                  "expr": 13
                                },
                                "bullet": {
                                  "kind": "bullet",
                                  "bullet": {
                                    "id": "inline_bullet"
                                  }
                                }
                              }
                            }
                          ]
                        }
                      },
                      {
                        "op": "wait",
                        "expr": 14
                      }
                    ]
                  }
                },
                {
                  "op": "vanish"
                }
              ]
            }
          }
        ]
      }
    ],
    "fires": []
  },
  "expressions": [
    {
      "id": 0,
      "source": "6"
    },
    {
      "id": 1,
      "source": "0"
    },
    {
      "id": 2,
      "source": "20"
    },
    {
      "id": 3,
      "source": "20"
    },
    {
      "id": 4,
      "source": "150+$rank*100"
    },
    {
      "id": 5,
      "source": "90*$rand-45"
    },
    {
      "id": 6,
      "source": "3-$rank*2"
    },
    {
      "id": 7,
      "source": "0"
    },
    {
      "id": 8,
      "source": "7"
    },
    {
      "id": 9,
      "source": "3"
    },
    {
      "id": 10,
      "source": "20"
    },
    {
      "id": 11,
      "source": "2"
    },
    {
      "id": 12,
      "source": "0"
    },
    {
      "id": 13,
      "source": "3"
    },
    {
      "id": 14,
      "source": "30"
    },
    {
      "id": 15,
      "source": "90"
    },
    {
      "id": 16,
      "source": "-90"
    },
    {
      "id": 17,
      "source": "550"
    }
  ]
}
