{
  "format": "gams.gbml",
  "version": 1,
  "source": {
    "language": "bulletml-0.21",
    "orientation": "vertical",
    "path": "examples/[Psyvariar]_X-A_boss_opening.xml"
  },
  "compatibility": {
    "semantics": "gams-corrected-v1"
  },
  "entrypoints": [
    {
      "name": "top",
      "action": "action:top"
    }
  ],
  "definitions": {
    "actions": [
      {
        "id": "action:top",
        "label": "top",
        "ops": [
          {
            "op": "repeat",
            "times": 0,
            "action": {
              "id": "inline_action",
              "ops": [
                {
                  "op": "fire",
                  "fire": {
                    "id": "inline_fire",
                    "direction": {
                      "mode": "aim",
                      "expr": 1
                    },
                    "speed": {
                      "mode": "absolute",
                      "expr": 2
                    },
                    "bullet": {
                      "kind": "bullet",
                      "bullet": {
                        "id": "inline_bullet"
                      }
                    }
                  }
                },
                {
                  "op": "wait",
                  "expr": 3
                }
              ]
            }
          },
          {
            "op": "wait",
            "expr": 4
          }
        ]
      }
    ],
    "bullets": [],
    "fires": []
  },
  "expressions": [
    {
      "id": 0,
      "source": "600"
    },
    {
      "id": 1,
      "source": "-45+$rand*90"
    },
    {
      "id": 2,
      "source": "(0.3+$rand*0.5)*($rank+1)"
    },
    {
      "id": 3,
      "source": "1"
    },
    {
      "id": 4,
      "source": "100"
    }
  ]
}
